{
  "$schema": "evidence/v1/schema/evidence-manifest.schema.json",
  "schema": {
    "id": "unified-ble-manager/evidence-manifest",
    "version": "1.0.0"
  },
  "claim": {
    "id": "fixture-live-preview-l4",
    "revision": 1,
    "claimVersion": "1.0.0",
    "issuerKind": "first-party",
    "publishedSupportLabel": "Live Preview",
    "targetSupportLabel": "Supported",
    "supportMatrix": {
      "environments": [],
      "entries": []
    }
  },
  "subject": {
    "backend": {
      "id": "fixture-backend",
      "implementation": "fixture backend",
      "version": "0.0.0"
    },
    "platform": {
      "id": "fixture-platform",
      "os": "FixtureOS",
      "architecture": "fixture64"
    },
    "host": {
      "id": "fixture-host",
      "processRole": "node"
    },
    "runtime": {
      "node": "22.16.0"
    },
    "toolchain": {
      "node-gyp": "13.0.1"
    },
    "packageArtifact": {
      "name": "fixture-package",
      "version": "0.0.0",
      "availability": "verified",
      "type": "build-output",
      "path": "evidence/v1/fixtures/artifacts/build-output/lib/commonjs/index.js",
      "sha256": "166fa009d64102d513a11ac304eef911b160d58efd3f1736da4b304911cc8460",
      "artifactId": "fixture-package-artifact"
    },
    "protocolVersions": {
      "package": "0.0.0",
      "backendContract": 1,
      "capabilitySchema": 1,
      "eventSchema": 1,
      "nativeOrIpc": 1,
      "trace": 1
    },
    "capabilities": [
      {
        "id": "fixture-scan",
        "supportLevel": "native",
        "evidenceLevel": "L4",
        "limitationIds": [
          "fixture-live-limit"
        ]
      }
    ]
  },
  "source": {
    "repository": "fixture-repository",
    "commit": "0123456789abcdef0123456789abcdef01234567",
    "dirty": false,
    "dirtyStateArtifactId": "fixture-source-state"
  },
  "execution": {
    "provenance": "live-radio",
    "deterministic": false,
    "liveRadio": true,
    "capturedAt": "2026-07-25T20:00:05.000Z",
    "startedAt": "2026-07-25T20:00:00.000Z",
    "endedAt": "2026-07-25T20:00:04.000Z",
    "hardware": {
      "adapter": {
        "safeId": "fixture-adapter",
        "kind": "ble-adapter",
        "redaction": "all-identifiers-redacted"
      },
      "machine": {
        "safeId": "fixture-machine",
        "kind": "test-machine",
        "redaction": "none"
      }
    },
    "peripherals": [
      {
        "safeId": "fixture-fixed-peripheral",
        "kind": "fixed-function",
        "physical": true,
        "controllerFeatures": [],
        "redaction": "identifier-redacted"
      }
    ],
    "commands": [
      {
        "id": "fixture-live-command",
        "argv": [
          "node",
          "live.js"
        ],
        "cwd": ".",
        "startedAt": "2026-07-25T20:00:00.000Z",
        "endedAt": "2026-07-25T20:00:04.000Z",
        "exitCode": 0,
        "resultArtifactId": "fixture-log",
        "toolIdentity": "unified-ble-tck",
        "profileId": "fixture-live-suite",
        "receiptArtifactId": "fixture-live-command-receipt"
      }
    ]
  },
  "proof": {
    "level": "L4",
    "status": "passed",
    "reason": "",
    "supportGate": true,
    "scenarios": [
      {
        "id": "fixture-live-compile",
        "kind": "compile-package",
        "result": "passed",
        "level": "L2",
        "provenance": "compile",
        "artifactIds": [
          "fixture-log"
        ],
        "commandIds": [
          "fixture-live-command"
        ],
        "peripheralIds": [],
        "requiredControllerFeatures": [],
        "startedAt": "2026-07-25T20:00:00.000Z",
        "endedAt": "2026-07-25T20:00:01.000Z"
      },
      {
        "id": "fixture-live-tck",
        "kind": "tck",
        "result": "passed",
        "level": "L1",
        "provenance": "deterministic",
        "artifactIds": [
          "fixture-log"
        ],
        "commandIds": [
          "fixture-live-command"
        ],
        "peripheralIds": [],
        "requiredControllerFeatures": [],
        "startedAt": "2026-07-25T20:00:01.000Z",
        "endedAt": "2026-07-25T20:00:02.000Z"
      },
      {
        "id": "fixture-native-handshake",
        "kind": "native-abi",
        "result": "passed",
        "level": "L3",
        "provenance": "system",
        "artifactIds": [
          "fixture-log"
        ],
        "commandIds": [
          "fixture-live-command"
        ],
        "peripheralIds": [],
        "requiredControllerFeatures": [],
        "startedAt": "2026-07-25T20:00:02.000Z",
        "endedAt": "2026-07-25T20:00:03.000Z"
      },
      {
        "id": "fixture-live-vertical",
        "kind": "vertical-slice",
        "result": "passed",
        "level": "L4",
        "provenance": "live-radio",
        "artifactIds": [
          "fixture-log"
        ],
        "commandIds": [
          "fixture-live-command"
        ],
        "peripheralIds": [
          "fixture-fixed-peripheral"
        ],
        "requiredControllerFeatures": [],
        "startedAt": "2026-07-25T20:00:03.000Z",
        "endedAt": "2026-07-25T20:00:04.000Z"
      }
    ]
  },
  "artifacts": [
    {
      "id": "fixture-log",
      "artifactType": "command-result",
      "path": "evidence/v1/fixtures/artifacts/fixture.log",
      "sha256": "3c9d8614c2d8eb8ce74c07ed07cf11c179f254ca684c2bee6551a9f64fbda0fb",
      "mediaType": "text/plain",
      "redaction": "contains-no-sensitive-data"
    },
    {
      "id": "fixture-package-artifact",
      "artifactType": "package-artifact",
      "packageType": "build-output",
      "path": "evidence/v1/fixtures/artifacts/build-output/lib/commonjs/index.js",
      "sha256": "166fa009d64102d513a11ac304eef911b160d58efd3f1736da4b304911cc8460",
      "mediaType": "application/javascript",
      "redaction": "contains-no-sensitive-data"
    },
    {
      "id": "fixture-source-state",
      "artifactType": "source-state",
      "path": "evidence/v1/fixtures/artifacts/fixture-source-state.log",
      "sha256": "99797f31e6a7d138c0f174790200f10735ffffd85c960d8f1f1e6eb26832db1f",
      "mediaType": "text/plain",
      "redaction": "contains-no-sensitive-data"
    },
    {
      "id": "fixture-live-command-receipt",
      "artifactType": "command-receipt",
      "path": "evidence/v1/fixtures/artifacts/valid-live-preview-l4.receipt.json",
      "sha256": "f09f9f668f4241989e2b8afb7384b1abb37af605ada9616312b0ab01effe8713",
      "mediaType": "application/json",
      "redaction": "contains-no-sensitive-data"
    }
  ],
  "limitations": [
    {
      "id": "fixture-live-limit",
      "description": "Reliability proof is deliberately not claimed.",
      "status": "open"
    }
  ],
  "attestations": {
    "securityReviewed": true,
    "privacyReviewed": true,
    "redactionApplied": true,
    "noSecretsIncluded": true,
    "noTelemetryUsed": true
  },
  "boundary": {
    "kind": "native-abi",
    "abiOrProtocol": "node-abi-127",
    "processBoundary": "node-native",
    "compatibility": {
      "version": 1,
      "minimumVersion": 1,
      "maximumVersion": 1,
      "handshakeScenarioId": "fixture-native-handshake"
    }
  },
  "ownership": {
    "maintainer": {
      "id": "fixture-owner",
      "contact": "fixture@example.invalid"
    },
    "revalidation": {
      "cadenceDays": 30,
      "nextDueAt": "2026-08-24T20:00:05.000Z",
      "triggers": [
        "fixture revision"
      ]
    }
  },
  "history": {
    "supersedes": [],
    "supersededBy": null
  }
}
