{
  "$schema": "evidence/v1/schema/evidence-manifest.schema.json", "schema": { "id": "unified-ble-manager/evidence-manifest", "version": "1.0.0" },
  "claim": { "id": "fixture-reported-unverified", "revision": 1, "claimVersion": "1.0.0", "issuerKind": "first-party", "publishedSupportLabel": "Experimental", "targetSupportLabel": "Supported", "supportMatrix": { "environments": [], "entries": [] } },
  "subject": { "backend": { "id": "fixture-backend", "implementation": "fixture backend", "version": "0.0.0" }, "platform": { "id": "fixture-platform", "os": "FixtureOS", "architecture": "fixture64" }, "host": { "id": "fixture-host", "processRole": "node" }, "runtime": { "node": "22.16.0" }, "toolchain": { "node": "22.16.0" }, "packageArtifact": { "name": "fixture-package", "version": "0.0.0", "availability": "unavailable", "type": "unavailable", "path": null, "sha256": null, "artifactId": null }, "protocolVersions": { "package": "0.0.0", "backendContract": null, "capabilitySchema": null, "eventSchema": null, "nativeOrIpc": null, "trace": null }, "capabilities": [] },
  "source": { "repository": "fixture-repository", "commit": "0123456789abcdef0123456789abcdef01234567", "dirty": false, "dirtyStateArtifactId": "fixture-source-state" },
  "execution": { "provenance": "reported-unverified", "deterministic": false, "liveRadio": false, "capturedAt": "2026-07-25T20:00:03.000Z", "startedAt": "2026-07-25T20:00:00.000Z", "endedAt": "2026-07-25T20:00:02.000Z", "hardware": { "adapter": { "safeId": "fixture-adapter", "kind": "unreported", "redaction": "all-identifiers-redacted" }, "machine": { "safeId": "fixture-machine", "kind": "unreported", "redaction": "all-identifiers-redacted" } }, "peripherals": [], "commands": [{ "id": "fixture-reported-command", "argv": ["historical-maintainer-report"], "cwd": ".", "startedAt": "2026-07-25T20:00:00.000Z", "endedAt": "2026-07-25T20:00:02.000Z", "exitCode": 0, "resultArtifactId": "fixture-log" }] },
  "proof": { "level": "L0", "status": "blocked", "reason": "Historical report has no command-result artifact or hardware record.", "supportGate": false, "scenarios": [{ "id": "fixture-reported-live", "kind": "vertical-slice", "result": "blocked", "level": "L0", "provenance": "reported-unverified", "artifactIds": ["fixture-log"], "commandIds": ["fixture-reported-command"], "peripheralIds": [], "requiredControllerFeatures": [], "startedAt": "2026-07-25T20:00:00.000Z", "endedAt": "2026-07-25T20:00:02.000Z", "reason": "No attributable original live-run artifact exists." }] },
  "artifacts": [{ "id": "fixture-log", "artifactType": "command-result", "path": "evidence/v1/fixtures/artifacts/fixture.log", "sha256": "3c9d8614c2d8eb8ce74c07ed07cf11c179f254ca684c2bee6551a9f64fbda0fb", "mediaType": "text/plain", "redaction": "contains-no-sensitive-data" }, { "id": "fixture-source-state", "artifactType": "source-state", "path": "evidence/v1/fixtures/artifacts/fixture-source-state.log", "sha256": "99797f31e6a7d138c0f174790200f10735ffffd85c960d8f1f1e6eb26832db1f", "mediaType": "text/plain", "redaction": "contains-no-sensitive-data" }], "limitations": [{ "id": "fixture-missing-live-artifacts", "description": "Reported exercise cannot support a public label until re-run with artifacts.", "status": "blocked" }], "attestations": { "securityReviewed": true, "privacyReviewed": true, "redactionApplied": true, "noSecretsIncluded": true, "noTelemetryUsed": true }, "boundary": { "kind": "native-abi", "abiOrProtocol": "unreported", "processBoundary": "node-native", "compatibility": null }, "ownership": { "maintainer": { "id": "fixture-owner", "contact": "fixture@example.invalid" }, "revalidation": { "cadenceDays": 30, "nextDueAt": "2026-08-24T20:00:03.000Z", "triggers": ["artifact recovery", "live re-run"] } }, "history": { "supersedes": [], "supersededBy": null }
}
